<?xml version="1.0"?>
<respuestas xmlns:xsi="http://www.w3.org/2001/XMLSchema-instance" xsi:noNamespaceSchemaLocation="guardarRespuestas.xsd">
<respuesta id_respuesta="1"><nombre>Asier</nombre><comentario>guay</comentario><fecha>20-01-12</fecha><email>99@gmail.com</email></respuesta><respuesta id_respuesta="1"><nombre>asier</nombre><comentario>Sin duda</comentario><fecha>20-01-15</fecha><email>99@gmail.com</email></respuesta><respuesta id_respuesta="2"><nombre>as</nombre><comentario>Tienes razon</comentario><fecha>20-01-15</fecha><email>99@gmail.com</email></respuesta><respuesta id_respuesta="2"><nombre>asier</nombre><comentario>Claro</comentario><fecha>20-01-15</fecha><email>99@gmail.com</email></respuesta><respuesta id_respuesta="1"><nombre>Asier</nombre><comentario>ma&#xF1;ana toca rally</comentario><fecha>20-01-15</fecha><email>99@gmail.com</email></respuesta><respuesta id_respuesta="3"><nombre>Asier</nombre><comentario>No lo creo</comentario><fecha>20-01-15</fecha><email>99@gmail.com</email></respuesta><respuesta id_respuesta="4"><nombre>Asier</nombre><comentario>No sabes de coches compi</comentario><fecha>20-01-15</fecha><email>99@gmail.com</email></respuesta><respuesta id_respuesta="9"><nombre>Asier</nombre><comentario>Mejor subaru</comentario><fecha>20-01-17</fecha><email>99@gmail.com</email></respuesta><respuesta id_respuesta="8"><nombre>Asier</nombre><comentario>jajajajajaja</comentario><fecha>20-01-17</fecha><email>99@gmail.com</email></respuesta><respuesta id_respuesta="7"><nombre>Asier</nombre><comentario>Mejor coche japo</comentario><fecha>20-01-17</fecha><email>99@gmail.com</email></respuesta><respuesta id_respuesta="3"><nombre>Asier</nombre><comentario>Si lo es</comentario><fecha>20-01-17</fecha><email>99@gmail.com</email></respuesta><respuesta id_respuesta="5"><nombre>Asier</nombre><comentario>Inconfundible</comentario><fecha>20-01-17</fecha><email>99@gmail.com</email></respuesta><respuesta id_respuesta="6"><nombre>Asier</nombre><comentario>jajajaja no te lo crees ni tu</comentario><fecha>20-01-17</fecha><email>99@gmail.com</email></respuesta><respuesta id_respuesta="8"><nombre>Asier</nombre><comentario>increible</comentario><fecha>20-01-17</fecha><email>99@gmail.com</email></respuesta><respuesta id_respuesta="9"><nombre>Asier</nombre><comentario>que va</comentario><fecha>20-01-17</fecha><email>99@gmail.com</email></respuesta><respuesta id_respuesta="3"><nombre>Asier</nombre><comentario>motor 2JZ no digo m&#xE1;s</comentario><fecha>20-01-17</fecha><email>99@gmail.com</email></respuesta><respuesta id_respuesta="1"><nombre>Asier</nombre><comentario>toca Hondarribia</comentario><fecha>20-01-17</fecha><email>99@gmail.com</email></respuesta></respuestas>
